{
  "id": "blood-profit-run1",
  "name": "Blood & Profit Run 1: Single Corsair",
  "description": "Training scenario: Single corsair at medium range. Basic combat drill.",
  "difficulty": "training",
  "startConditions": {
    "range_band": "medium",
    "alert_status": "YELLOW"
  },
  "contacts": [
    {
      "name": "Corsair Alpha",
      "type": "corsair",
      "disposition": "hostile",
      "bearing": 45,
      "range_km": 8000,
      "health": 30,
      "max_health": 30,
      "armor": 2,
      "gunner_skill": 1,
      "transponder": "Unknown",
      "signature": "normal",
      "weapons": [
        { "name": "Triple Turret Laser", "damage": "3d6", "range": "medium" }
      ]
    }
  ]
}
